{
  "$schema": "https://json-schema.org/draft/2020-12/schema",
  "title": "Proposed sensitive terms (05-terms/candidates.json, 07-sanitized/new-terms.json)",
  "type": "array",
  "items": {
    "type": "object",
    "required": ["term", "kind", "proposed_replacement", "found_in"],
    "additionalProperties": false,
    "properties": {
      "term": {"type": "string", "minLength": 2},
      "kind": {"enum": ["codename", "customer", "product", "url", "financial", "other"]},
      "proposed_replacement": {"type": "string"},
      "found_in": {"type": "array", "items": {"type": "string"}}
    }
  }
}
