[
  {
    "term": "Project Falcon",
    "kind": "codename",
    "proposed_replacement": "real-time fraud-detection platform",
    "found_in": [
      "pj_da2a2b53",
      "ev_99a74656",
      "ev_191cc8ce"
    ]
  },
  {
    "term": "Contoso Bank",
    "kind": "customer",
    "proposed_replacement": "a top-10 US bank",
    "found_in": [
      "pj_da2a2b53",
      "ev_99a74656",
      "ev_191cc8ce"
    ]
  }
]
